{
  "v": 1,
  "generated_at": "2026-02-19",
  "repo_version": "0.1.0",
  "invariants": [
    {
      "id": "I-001-traceability",
      "title": "Traceability",
      "contracts": [
        "foundation/invariants/I-001-traceability.md"
      ],
      "spec_artifacts": [
        "contracts/protocol/include/protocol.h",
        "contracts/protocol/include/transport.h",
        "contracts/protocol/include/errors.h",
        "REGISTRY.md"
      ],
      "vectors": [
        "vectors/audit_vectors.json",
        "vectors/transport_vectors.json"
      ],
      "formal": [
        {
          "module": "formal/tla/YAI_KERNEL.tla",
          "config": "formal/configs/YAI_KERNEL.quick.cfg",
          "properties": [
            "TypeInvariant"
          ]
        }
      ],
      "bindings": [
        "contracts/protocol/BINDING.md",
        "contracts/cli/BINDING.md"
      ],
      "coverage": {
        "docs": true,
        "tests": true,
        "formal": true
      },
      "ontology_scopes": [
        "core",
        "exec",
        "brain"
      ]
    },
    {
      "id": "I-002-determinism",
      "title": "Determinism and Reproducibility",
      "contracts": [
        "foundation/invariants/I-002-determinism.md"
      ],
      "spec_artifacts": [
        "contracts/protocol/runtime/include/rpc_runtime.h",
        "contracts/protocol/include/session.h",
        "contracts/vault/include/yai_vault_abi.h"
      ],
      "vectors": [
        "vectors/transport_vectors.json",
        "vectors/audit_vectors.json"
      ],
      "formal": [
        {
          "module": "formal/tla/YAI_KERNEL.tla",
          "config": "formal/configs/YAI_KERNEL.quick.cfg",
          "properties": [
            "TypeInvariant",
            "EnergySafe"
          ]
        }
      ],
      "bindings": [
        "contracts/protocol/BINDING.md",
        "contracts/vault/BINDING.md",
        "runtime/brain/graph/BINDING.md"
      ],
      "coverage": {
        "docs": true,
        "tests": true,
        "formal": true
      },
      "ontology_scopes": [
        "core",
        "exec",
        "brain"
      ]
    },
    {
      "id": "I-003-governance",
      "title": "Governance",
      "contracts": [
        "foundation/invariants/I-003-governance.md"
      ],
      "spec_artifacts": [
        "contracts/control/schema/authority.json",
        "contracts/control/schema/control_plane.v1.json",
        "contracts/protocol/include/roles.h"
      ],
      "vectors": [
        "vectors/auth_vectors.json",
        "vectors/audit_vectors.json"
      ],
      "formal": [
        {
          "module": "formal/tla/YAI_KERNEL.tla",
          "config": "formal/configs/YAI_KERNEL.quick.cfg",
          "properties": [
            "AuthorityRequired"
          ]
        }
      ],
      "bindings": [
        "contracts/control/BINDING.md",
        "contracts/protocol/BINDING.md"
      ],
      "coverage": {
        "docs": true,
        "tests": true,
        "formal": true
      },
      "ontology_scopes": [
        "core"
      ]
    },
    {
      "id": "I-004-cognitive-reconfiguration",
      "title": "Governable Cognitive Reconfiguration",
      "contracts": [
        "foundation/invariants/I-004-cognitive-reconfiguration.md"
      ],
      "spec_artifacts": [
        "contracts/protocol/include/session.h",
        "contracts/control/schema/control_plane.v1.json"
      ],
      "vectors": [
        "vectors/audit_vectors.json"
      ],
      "formal": [
        {
          "module": "formal/tla/YAI_KERNEL.tla",
          "config": "formal/configs/YAI_KERNEL.quick.cfg",
          "properties": [
            "CognitiveIntegrity"
          ]
        }
      ],
      "bindings": [
        "contracts/control/BINDING.md"
      ],
      "coverage": {
        "docs": true,
        "tests": true,
        "formal": true
      },
      "ontology_scopes": [
        "core",
        "brain"
      ]
    },
    {
      "id": "I-005-abstract-cost-accountability",
      "title": "Abstract Cost Accountability",
      "contracts": [
        "foundation/invariants/I-005-abstract-cost-accountability.md"
      ],
      "spec_artifacts": [
        "runtime/exec/schema/engine_cortex.v1.json",
        "contracts/protocol/runtime/include/rpc_runtime.h",
        "runtime/brain/graph/schema/graph.v1.json"
      ],
      "vectors": [
        "vectors/audit_vectors.json"
      ],
      "formal": [
        {
          "module": "formal/tla/YAI_KERNEL.tla",
          "config": "formal/configs/YAI_KERNEL.quick.cfg",
          "properties": [
            "EnergySafe"
          ]
        }
      ],
      "bindings": [
        "runtime/brain/graph/BINDING.md",
        "contracts/protocol/BINDING.md"
      ],
      "coverage": {
        "docs": true,
        "tests": true,
        "formal": true
      },
      "ontology_scopes": [
        "exec",
        "brain"
      ]
    },
    {
      "id": "I-006-external-effect-boundary",
      "title": "External Effect Boundary",
      "contracts": [
        "foundation/invariants/I-006-external-effect-boundary.md"
      ],
      "spec_artifacts": [
        "contracts/control/schema/authority.json",
        "schema/compliance.context.v1.json",
        "contracts/protocol/include/auth.h"
      ],
      "vectors": [
        "vectors/auth_vectors.json",
        "vectors/audit_vectors.json"
      ],
      "formal": [
        {
          "module": "formal/tla/YAI_KERNEL.tla",
          "config": "formal/configs/YAI_KERNEL.quick.cfg",
          "properties": [
            "ExternalEffectGuard"
          ]
        }
      ],
      "bindings": [
        "contracts/control/BINDING.md",
        "contracts/compliance/README.md"
      ],
      "coverage": {
        "docs": true,
        "tests": true,
        "formal": true
      },
      "ontology_scopes": [
        "core",
        "exec"
      ]
    },
    {
      "id": "I-007-compliance-context-required",
      "title": "Compliance Context Required",
      "contracts": [
        "foundation/invariants/I-007-compliance-context-required.md"
      ],
      "spec_artifacts": [
        "schema/compliance.context.v1.json",
        "contracts/control/schema/control_plane.v1.json",
        "contracts/control/schema/authority.json"
      ],
      "vectors": [
        "vectors/audit_vectors.json"
      ],
      "formal": [
        {
          "module": "formal/tla/YAI_KERNEL.tla",
          "config": "formal/configs/YAI_KERNEL.quick.cfg",
          "properties": [
            "[](external_effect => compliance_context_valid)"
          ]
        }
      ],
      "bindings": [
        "contracts/compliance/README.md",
        "contracts/control/BINDING.md"
      ],
      "coverage": {
        "docs": true,
        "tests": true,
        "formal": true
      },
      "ontology_scopes": [
        "core",
        "exec",
        "brain"
      ]
    }
  ],
  "runtime_ontology": {
    "primary": [
      "core",
      "exec",
      "brain"
    ],
    "cross_cutting": [
      "protocol",
      "platform",
      "support"
    ],
    "historical_aliases": {
      "core": "core(alias)",
      "exec": "exec(alias)",
      "brain": "brain(alias)",
      "ingress": "core.dispatch(alias)",
      "boot": "core.lifecycle(alias)"
    },
    "artifact_naming_policy": "staged-transition"
  }
}
